[
  {
    "client_id": "cli_s01",
    "project_id": "prj_sample",
    "client_name": "Mekong Aqua Utilities (가상)",
    "country": "VN",
    "industry": "상수도 운영",
    "discovery_rationale": "건기 염분 상승 구간에서 측정 주기를 늘려야 하는데 수동 채수에 의존하고 있고(fnd_s03), 우리의 다항목 단일 모듈은 설치·유지보수 부담을 줄이는 방향이다(fnd_s01, fnd_s04). 즉 우리 역량이 이 사업자의 인력 부담 문제에 직접 대응한다.",
    "market_scope": "INTERNATIONAL",
    "finding_ids": ["fnd_s01", "fnd_s03", "fnd_s04"],
    "fit_screening": {
      "problem_fit": "STRONG",
      "solution_fit": "STRONG",
      "capability_fit": "MODERATE"
    },
    "priority": {
      "market_attractiveness": "MODERATE",
      "purchasing_potential": "EVIDENCE_NEEDED",
      "accessibility": "EVIDENCE_NEEDED",
      "competitive_situation": "MODERATE",
      "evidence_quality": "MODERATE",
      "sales_priority": "P1",
      "rationale": "문제 정합성과 솔루션 정합성은 근거가 있으나 예산·접근경로는 미확인이다. 우선순위를 P1로 두는 이유는 점수 합계가 아니라 문제 심각도가 확인된 유일한 후보라는 점이다."
    },
    "status": "PRIORITIZED",
    "lang": "ko",
    "created_at": "2026-09-18T09:20:00+00:00",
    "schema_version": "0.1"
  },
  {
    "client_id": "cli_s02",
    "project_id": "prj_sample",
    "client_name": "Delta Industrial Park Management (가상)",
    "country": "VN",
    "industry": "산업단지 관리",
    "discovery_rationale": "방류수 수질 상시 감시 의무가 있을 가능성이 있어 동일 제품이 적용될 수 있다. 다만 이 의무의 존재 자체가 업로드 자료로 확인되지 않았다(fnd_s05).",
    "market_scope": "INTERNATIONAL",
    "finding_ids": ["fnd_s04", "fnd_s05"],
    "fit_screening": {
      "problem_fit": "EVIDENCE_NEEDED",
      "solution_fit": "MODERATE",
      "capability_fit": "MODERATE"
    },
    "priority": {
      "market_attractiveness": "UNKNOWN",
      "purchasing_potential": "UNKNOWN",
      "accessibility": "UNKNOWN",
      "competitive_situation": "UNKNOWN",
      "evidence_quality": "WEAK",
      "sales_priority": "DEFERRED",
      "rationale": "규제 요건이 확인되지 않아 문제 자체가 성립하는지 알 수 없다. 숫자를 만들어 채우지 않고 보류한다."
    },
    "status": "DEFERRED",
    "lang": "ko",
    "created_at": "2026-09-18T09:20:10+00:00",
    "schema_version": "0.1"
  }
]
